{
  "handoff_id": "additive-non-manifold-geometry-2026-09-17",
  "job_id": "additive-fdm-bracket",
  "revision": "A",
  "status": "blocked",
  "process_family": "additive",
  "consequence_level": "execution_adjacent",
  "units": "mm",
  "artifacts": [
    {
      "artifact_id": "bracket.scad",
      "path": "fixtures/cad/bracket/source/bracket.scad",
      "kind": "native_cad_source",
      "authority": "authoritative",
      "revision": "A",
      "units": "mm",
      "sha256": "100c7de74d5e3b1dfea37f2c3b7f7d8182339d053acee6f711a167f5d2cdb811"
    },
    {
      "artifact_id": "additive-non-manifold-geometry",
      "path": "replay:additive/non-manifold-geometry/input.stl",
      "kind": "mesh_derivative",
      "authority": "derived",
      "revision": "A",
      "units": "mm",
      "sha256": "2fd7caa027e8e190efdc940a5993fdacf3c6d5ad2a78d327a4c82427c1cdf9cf"
    }
  ],
  "context_fingerprint": "39932523b81b37a8e15756d4328226a6768709b598f78c350f3c844c59ef0bd6",
  "context_fingerprint_version": 2,
  "assumptions": [
    {
      "statement": "Printer/material lifecycle reviews remain unverified synthetic declarations; no applicable OEM, material-grade or slicer-profile evidence is established.",
      "status": "unresolved",
      "evidence": [
        "docs/evaluation/additive-runs/2026-09-17-non-manifold-geometry/observed.json",
        "docs/evaluation/additive-runs/2026-09-17-non-manifold-geometry/review.md"
      ]
    },
    {
      "statement": "Job orientation/support reviewed flags, slicer verified flag and any environment known label lack supporting job-specific review records; they cannot authorize manufacture.",
      "status": "unresolved",
      "evidence": [
        "docs/evaluation/additive-runs/2026-09-17-non-manifold-geometry/observed.json",
        "docs/evaluation/additive-runs/2026-09-17-non-manifold-geometry/review.md"
      ]
    },
    {
      "statement": "Partial mesh/package checks and independent geometry exports do not establish self-intersection/fill correctness, functional design intent, usable-bed/support clearance, a verified sliced build or qualified approval.",
      "status": "unresolved",
      "evidence": [
        "docs/evaluation/additive-runs/2026-09-17-non-manifold-geometry/observed.json",
        "docs/evaluation/additive-runs/2026-09-17-non-manifold-geometry/review.md"
      ]
    },
    {
      "statement": "The derivative is open despite its valid metadata label; manufacturing readiness is blocked independently of the unchanged profile and environmental gaps.",
      "status": "unresolved",
      "evidence": [
        "docs/evaluation/additive-runs/2026-09-17-non-manifold-geometry/observed.json",
        "docs/evaluation/additive-runs/2026-09-17-non-manifold-geometry/review.md"
      ]
    }
  ],
  "verification": [
    {
      "check_id": "additive_partial_geometry_and_context",
      "status": "inconclusive",
      "summary": "File-derived partial evidence only; profile, intent, slicer, orientation/support, environment and qualified review are unresolved.",
      "evidence": [
        "docs/evaluation/additive-runs/2026-09-17-non-manifold-geometry/observed.json"
      ]
    }
  ],
  "simulation": {
    "status": "required",
    "reason": "Applicable slicer/layer-preview and build verification has not been performed for this job; native geometry import/export is not that evidence.",
    "required_checks": [
      "Confirm source intent, units, revision and the exact mesh/package including unresolved geometry semantics",
      "Review applicable printer/material/slicer configuration, build placement, orientation/support and usable-bed clearances",
      "Verify the resulting sliced build and record limitations against the same reviewed inputs and qualified environmental/operator context"
    ],
    "evidence": []
  },
  "human_review": {
    "action": "Have the design/geometry reviewer establish a corrected derivative from the controlled source, retain its new identity and derivation evidence, and repeat topology, design-equivalence, slicer and context reviews. Do not infer repair success from a tool's zero exit. Resolve all unchanged baseline evidence gaps. Do not print from this packet.",
    "scope": [
      "manufacturing_handoff",
      "context_review",
      "slicer_verification"
    ],
    "reviewer_role": "Qualified design authority, additive process/profile reviewer and responsible site/operator reviewer"
  },
  "blockers": [
    "HUMAN_APPROVAL_REQUIRED",
    "MISSING_CONTEXT",
    "SOURCE_VERIFICATION_REQUIRED"
  ],
  "review_required": true,
  "execution_allowed": false,
  "approval_id": null
}
