{
  "handoff_id": "additive-3mf-unit-conflict-2026-09-17",
  "job_id": "additive-unit-tetrahedron",
  "revision": "A",
  "status": "blocked",
  "process_family": "additive",
  "consequence_level": "execution_adjacent",
  "units": "mm",
  "artifacts": [
    {
      "artifact_id": "tetrahedron-source.json",
      "path": "fixtures/additive/prusaslicer-lab/tetrahedron-source.json",
      "kind": "synthetic_geometry_definition",
      "authority": "authoritative",
      "revision": "A",
      "units": "mm",
      "sha256": "4aeea5655ca192454e0d6861b167e43849560e61f8723759271d4e8872aa3c2b"
    },
    {
      "artifact_id": "additive-3mf-unit-conflict",
      "path": "replay:additive/3mf-unit-conflict/input.3mf",
      "kind": "print_package",
      "authority": "derived",
      "revision": "A",
      "units": "inch",
      "sha256": "a7f20af8f81faa8f37ab53ae76926506d355e08e2617c77d1ae3b8c8a2b97a7b"
    }
  ],
  "context_fingerprint": "9c81aa1c39dacffb8016d20c9fb5c441c4c591b4957c17e846aeef4e37adb5ef",
  "context_fingerprint_version": 2,
  "assumptions": [
    {
      "statement": "Printer/material lifecycle reviews remain unverified synthetic declarations; no applicable OEM, material-grade or slicer-profile evidence is established.",
      "status": "unresolved",
      "evidence": [
        "docs/evaluation/additive-runs/2026-09-17-3mf-unit-conflict/observed.json",
        "docs/evaluation/additive-runs/2026-09-17-3mf-unit-conflict/review.md"
      ]
    },
    {
      "statement": "Job orientation/support reviewed flags, slicer verified flag and any environment known label lack supporting job-specific review records; they cannot authorize manufacture.",
      "status": "unresolved",
      "evidence": [
        "docs/evaluation/additive-runs/2026-09-17-3mf-unit-conflict/observed.json",
        "docs/evaluation/additive-runs/2026-09-17-3mf-unit-conflict/review.md"
      ]
    },
    {
      "statement": "Partial mesh/package checks and independent geometry exports do not establish self-intersection/fill correctness, functional design intent, usable-bed/support clearance, a verified sliced build or qualified approval.",
      "status": "unresolved",
      "evidence": [
        "docs/evaluation/additive-runs/2026-09-17-3mf-unit-conflict/observed.json",
        "docs/evaluation/additive-runs/2026-09-17-3mf-unit-conflict/review.md"
      ]
    },
    {
      "statement": "Embedded inch units conflict with the controlled source and job's mm interpretation; envelope fit does not resolve design scale.",
      "status": "unresolved",
      "evidence": [
        "docs/evaluation/additive-runs/2026-09-17-3mf-unit-conflict/observed.json",
        "docs/evaluation/additive-runs/2026-09-17-3mf-unit-conflict/review.md"
      ]
    }
  ],
  "verification": [
    {
      "check_id": "additive_partial_geometry_and_context",
      "status": "inconclusive",
      "summary": "File-derived partial evidence only; profile, intent, slicer, orientation/support, environment and qualified review are unresolved.",
      "evidence": [
        "docs/evaluation/additive-runs/2026-09-17-3mf-unit-conflict/observed.json"
      ]
    }
  ],
  "simulation": {
    "status": "required",
    "reason": "Applicable slicer/layer-preview and build verification has not been performed for this job; native geometry import/export is not that evidence.",
    "required_checks": [
      "Confirm source intent, units, revision and the exact mesh/package including unresolved geometry semantics",
      "Review applicable printer/material/slicer configuration, build placement, orientation/support and usable-bed clearances",
      "Verify the resulting sliced build and record limitations against the same reviewed inputs and qualified environmental/operator context"
    ],
    "evidence": []
  },
  "human_review": {
    "action": "Ask the design owner to establish intended physical dimensions and issue a correctly unit-bound package or explicit reviewed conversion. Preserve both conflicting claims until resolved and invalidate dependent reviews after correcting units or package bytes. Resolve all unchanged baseline evidence gaps. Do not print from this packet.",
    "scope": [
      "manufacturing_handoff",
      "context_review",
      "slicer_verification"
    ],
    "reviewer_role": "Qualified design authority, additive process/profile reviewer and responsible site/operator reviewer"
  },
  "blockers": [
    "HUMAN_APPROVAL_REQUIRED",
    "MISSING_CONTEXT",
    "SOURCE_VERIFICATION_REQUIRED"
  ],
  "review_required": true,
  "execution_allowed": false,
  "approval_id": null
}
