{
  "handoff_id": "cnc-bracket-machine-limit-conflict-2026-09-17",
  "job_id": "cnc-mill-bracket",
  "revision": "B",
  "status": "blocked",
  "process_family": "cnc_milling",
  "consequence_level": "execution_adjacent",
  "units": "mm",
  "artifacts": [
    {
      "artifact_id": "bracket.scad",
      "authority": "authoritative",
      "kind": "native_cad_source",
      "path": "fixtures/cad/bracket/source/bracket.scad",
      "revision": "A",
      "sha256": "100c7de74d5e3b1dfea37f2c3b7f7d8182339d053acee6f711a167f5d2cdb811",
      "units": "mm"
    },
    {
      "artifact_id": "bracket.stl",
      "authority": "derived",
      "kind": "mesh_derivative",
      "path": "fixtures/cad/bracket/source/bracket.stl",
      "revision": "A",
      "sha256": "9447459b1eeb56d1cf1810dbbdd2f1598d349646a96b7183c682c600992e460e",
      "units": "mm"
    },
    {
      "artifact_id": "bracket.step",
      "authority": "derived",
      "kind": "neutral_solid_exchange",
      "path": "fixtures/cad/bracket/source/bracket.step",
      "revision": "A",
      "sha256": "fdd8e0913447b127b4734b9f090235051c3fc63ec841be05b9ac496f63dd6acd",
      "units": "mm"
    },
    {
      "artifact_id": "bracket.svg",
      "authority": "derived",
      "kind": "drawing_reference",
      "path": "fixtures/cad/bracket/source/bracket.svg",
      "revision": "A",
      "sha256": "cb7a476b0120da0bd8c8e6c04d2fae5071b66d908b511a56b1488204191c3b5f",
      "units": "mm"
    },
    {
      "artifact_id": "nc-machine-limit-conflict",
      "authority": "derived",
      "kind": "nc_program",
      "path": "replay:cnc/machine-limit-conflict/program.nc",
      "revision": "B",
      "sha256": "34791ff12c263611a9e112bd2edecf1a55e59897241ea747fe3bb4b10fc80b0b",
      "units": "mm"
    }
  ],
  "context_fingerprint": "cabcf5ddce64e28680047649b57e78731fef6512964ad217dffbc53e384aec9b",
  "context_fingerprint_version": 2,
  "assumptions": [
    {
      "statement": "Synthetic profile labels and the post validation flag do not establish real machine/controller/material/tool/post applicability; lifecycle reviews and tool availability remain unresolved.",
      "status": "unresolved",
      "evidence": [
        "docs/evaluation/cnc-runs/2026-09-17-machine-limit-conflict/observed.json",
        "docs/evaluation/cnc-runs/2026-09-17-machine-limit-conflict/review.md"
      ]
    },
    {
      "statement": "The linked CAD design intent and full stock/feature-to-operation plan are not established by the supplied rectangular NC; actual stock condition, tolerances, access and inspection acceptance need qualified review.",
      "status": "unresolved",
      "evidence": [
        "docs/evaluation/cnc-runs/2026-09-17-machine-limit-conflict/observed.json",
        "docs/evaluation/cnc-runs/2026-09-17-machine-limit-conflict/review.md"
      ]
    },
    {
      "statement": "Datum/WCS verification, coordinate mapping and initial position, fixture/tool-holder geometry and clamp clearance are unverified; no physical motion or collision verification is supplied.",
      "status": "unresolved",
      "evidence": [
        "docs/evaluation/cnc-runs/2026-09-17-machine-limit-conflict/observed.json",
        "docs/evaluation/cnc-runs/2026-09-17-machine-limit-conflict/review.md"
      ]
    },
    {
      "statement": "The altered line commands X100 Y0 where baseline commanded X60 Y0. X100 exceeds the raw fixture X bound of 60; physical transformed travel remains unverified.",
      "status": "unresolved",
      "evidence": [
        "docs/evaluation/cnc-runs/2026-09-17-machine-limit-conflict/observed.json",
        "docs/evaluation/cnc-runs/2026-09-17-machine-limit-conflict/review.md"
      ]
    }
  ],
  "verification": [
    {
      "check_id": "partial_static_review",
      "evidence": [
        "docs/evaluation/cnc-runs/2026-09-17-machine-limit-conflict/observed.json"
      ],
      "status": "inconclusive",
      "summary": "Offline reports retained; required context/simulation/review is unresolved. No physical verification."
    }
  ],
  "simulation": {
    "status": "required",
    "reason": "Only offline static/routing evidence is available; no applicable simulation has been performed.",
    "required_checks": [
      "Target/controller/post compatibility for exact reviewed NC bytes and versions",
      "Complete path and tool-change/approach/retract motion against reviewed machine, fixture and tool/holder geometry and coordinate context",
      "Stock-removal and feature coverage against controlled design, material/stock condition and setup sequence"
    ],
    "evidence": []
  },
  "human_review": {
    "action": "Have the CAM/setup reviewer resolve the suspicious extent against controlled design intent, reviewed coordinates and actual machine limits; do not enlarge limits or assume a compensating offset to make it pass.",
    "scope": [
      "manufacturing_handoff",
      "context_review",
      "simulation_verification"
    ],
    "reviewer_role": "Qualified design authority, CAM programmer, tooling/setup and manufacturing reviewers"
  },
  "blockers": [
    "HUMAN_APPROVAL_REQUIRED",
    "MACHINE_CONTEXT_REQUIRED",
    "MISSING_CONTEXT",
    "SIMULATION_REQUIRED",
    "SOURCE_VERIFICATION_REQUIRED"
  ],
  "review_required": true,
  "execution_allowed": false,
  "approval_id": null
}
