{
  "handoff_id": "laser-review-2026-09-17-scale-mismatch",
  "job_id": "laser-cut-bracket",
  "revision": "A",
  "status": "blocked",
  "process_family": "laser_cutting",
  "consequence_level": "execution_adjacent",
  "units": "mm",
  "artifacts": [
    {
      "artifact_id": "laser-source-manifest",
      "authority": "reference",
      "kind": "synthetic_source_inventory",
      "path": "fixtures/laser/cut-bracket/source-manifest.json",
      "revision": "A",
      "sha256": "7d382ce4b2de0e6b29df444ee1b2a7563700a0778424e8223799cb0f8ea595fa",
      "units": "mm"
    },
    {
      "artifact_id": "bracket.dxf",
      "authority": "authoritative",
      "kind": "two_d_test_source",
      "path": "fixtures/laser/cut-bracket/source/bracket.dxf",
      "revision": "A",
      "sha256": "200bb7af90248173158a9e9a84648a858ef244c6b61cea966e07a8832292761d",
      "units": "mm"
    },
    {
      "artifact_id": "laser-scale-mismatch",
      "authority": "derived",
      "kind": "two_d_cutting",
      "path": "replay:laser/scale-mismatch/input.dxf",
      "revision": "A",
      "sha256": "8a89fefabbc3c1bc034f7fa3275de8dd54602c95d03929c2f22209d79ac26d2d",
      "units": "mm"
    }
  ],
  "context_fingerprint": "a17922cdc4098e209538d20b83eaebe2404c7b56c92131fda2406ec1e08a07a7",
  "context_fingerprint_version": 2,
  "assumptions": [
    {
      "statement": "The physical drawing has doubled scale despite unchanged mm units and verified scale metadata.",
      "status": "unresolved",
      "evidence": [
        "docs/evaluation/laser-runs/2026-09-17-scale-mismatch/review.md",
        "docs/evaluation/laser-runs/2026-09-17-scale-mismatch/observed.json"
      ]
    },
    {
      "statement": "Controlled product requirements, tolerances, thickness and authenticated source-to-derivative design equivalence have not been provided.",
      "status": "unresolved",
      "evidence": [
        "docs/evaluation/laser-runs/2026-09-17-scale-mismatch/review.md",
        "docs/evaluation/laser-runs/2026-09-17-scale-mismatch/observed.json"
      ]
    },
    {
      "statement": "Cut intent, contour order/multiplicity, axis/orientation, placement, workholding and kerf require applicable design/process review; a zero-origin label is not calibration evidence.",
      "status": "unresolved",
      "evidence": [
        "docs/evaluation/laser-runs/2026-09-17-scale-mismatch/review.md",
        "docs/evaluation/laser-runs/2026-09-17-scale-mismatch/observed.json"
      ]
    },
    {
      "statement": "Actual stock identity/grade/thickness and applicable machine/material/process evidence are missing; synthetic verified flags and empty settings cannot supply parameters.",
      "status": "unresolved",
      "evidence": [
        "docs/evaluation/laser-runs/2026-09-17-scale-mismatch/review.md",
        "docs/evaluation/laser-runs/2026-09-17-scale-mismatch/observed.json"
      ]
    },
    {
      "statement": "Beam-risk evidence for the applicable machine, guards/interlocks, site and authorized operator is unresolved; no activation or bypass is permitted.",
      "status": "unresolved",
      "evidence": [
        "docs/evaluation/laser-runs/2026-09-17-scale-mismatch/review.md",
        "docs/evaluation/laser-runs/2026-09-17-scale-mismatch/observed.json"
      ]
    },
    {
      "statement": "Process-emission and ventilation evidence for the actual material/process/site is independently unresolved, regardless of beam review or generic known-status labels.",
      "status": "unresolved",
      "evidence": [
        "docs/evaluation/laser-runs/2026-09-17-scale-mismatch/review.md",
        "docs/evaluation/laser-runs/2026-09-17-scale-mismatch/observed.json"
      ]
    },
    {
      "statement": "Exact offline cut-path/output verification and qualified current-context human approval have not been supplied.",
      "status": "unresolved",
      "evidence": [
        "docs/evaluation/laser-runs/2026-09-17-scale-mismatch/review.md",
        "docs/evaluation/laser-runs/2026-09-17-scale-mismatch/observed.json"
      ]
    }
  ],
  "verification": [
    {
      "check_id": "laser_partial_file_and_context",
      "evidence": [
        "docs/evaluation/laser-runs/2026-09-17-scale-mismatch/observed.json"
      ],
      "status": "inconclusive",
      "summary": "Partial geometry/context evidence only; design intent, path/process applicability, beam and emission review, site context and qualified approval are unresolved."
    }
  ],
  "simulation": {
    "status": "required",
    "reason": "No applicable offline path/output verification has been supplied; partial source-contour inspection is not a verified manufacturing process.",
    "required_checks": [
      "Compare exact output geometry, physical scale, placement and axes against the controlled design.",
      "Review per-path cut/score/mark intent, order, multiplicity and applicable kerf/process evidence.",
      "Review the exact intended consumer/controller output and applicable machine/material/site context with qualified humans; do not run physical equipment."
    ],
    "evidence": []
  },
  "human_review": {
    "action": "Require design-owner confirmation of the intended geometry and a controlled corrected drawing or reviewed design revision. Do not automatically halve coordinates, change the expected dimensions, or equate available machine area with design acceptance. Resolve all baseline design, beam, emissions, process and offline-verification gaps before any new scoped approval.",
    "scope": [
      "manufacturing_handoff",
      "context_review",
      "offline_path_verification"
    ],
    "reviewer_role": "Qualified design and laser-process reviewers with responsible site/operator review"
  },
  "blockers": [
    "HUMAN_APPROVAL_REQUIRED",
    "MISSING_CONTEXT",
    "SOURCE_VERIFICATION_REQUIRED"
  ],
  "review_required": true,
  "execution_allowed": false,
  "approval_id": null
}
